{
  "$schema": "./course-schema.json",
  "slug": "system-design-foundations",
  "title": "System Design Foundations",
  "subtitle": "Running the hour, and the asynchronous patterns that most rounds are actually about",
  "audience": "Engineers who build and operate real systems but have not sat a system design round recently, or who have and found that they ran out of time before reaching the interesting part. It is about running the hour and having the right vocabulary, not about distributed systems theory.",
  "level": "advanced",
  "estimatedHours": 7,
  "timeNote": "About seven hours, and unlike the other courses most of it is not typing. Three of the modules are drawing and speaking practice, which people consistently skip and consistently should not - the difference between candidates in this round is pacing and narration, not knowledge.",
  "prerequisites": [
    "You have built or operated a production service",
    "You know roughly what a message queue, a cache and a relational database are for"
  ],
  "prerequisiteCourses": [],
  "outcomes": [
    "Run a sixty-minute design round in phases, spending the first eight minutes on questions",
    "Produce a scale estimate that justifies an architectural decision rather than filling time",
    "Draw an asynchronous ingestion pipeline from memory and narrate one record end to end",
    "Name and apply bulkheads, circuit breakers, jittered retries, dead letter queues and backpressure",
    "Explain the outbox pattern and why the write-then-publish arrow is not atomic",
    "Raise three failure modes before being asked, and close with build-first, deferred, and monitoring"
  ],
  "tags": [
    "system design",
    "distributed systems",
    "event driven",
    "interview technique"
  ],
  "version": 1,
  "modules": [
    {
      "id": "running-the-hour",
      "title": "How to run the hour",
      "summary": "The round has a shape, and most people fail it by drawing too early. Five phases, what belongs in each, and the questions that make the first eight minutes the strongest part of your hour.",
      "estimatedMinutes": 45,
      "objectives": [
        "Run a design round in phases rather than as one continuous ramble",
        "Ask scoping questions that change the design rather than filling time",
        "Know what is being assessed at each stage"
      ],
      "teaching": "## What is actually being assessed\n\nNot whether you know a particular architecture. There is no answer key. What the\ninterviewer is trying to find out is:\n\n- Can you take a vague problem and make it concrete enough to build?\n- Do you make trade-offs explicitly, or do you produce a design and defend it?\n- Do you know what breaks in production, and do you raise it before being asked?\n- Can they follow you? A design nobody can follow is worthless regardless of quality.\n\nEverything below is in service of demonstrating those four things.\n\n## The five phases\n\n| Time | Phase | What you do |\n|---|---|---|\n| 0-8 min | **Scope** | Ask questions. Write the requirements on the board. Do not draw. |\n| 8-15 min | **Estimate and contract** | Scale numbers. Core entities. The API or event contract. |\n| 15-40 min | **The happy path** | One clean box-and-arrow diagram. Narrate one record end to end. |\n| 40-52 min | **Break it** | Failure modes, retries, idempotency, backpressure, hot keys. |\n| 52-60 min | **Trade-offs and close** | What you would build first, what you deferred, what you would monitor. |\n\n**The single most common failure is drawing too early.** Eight minutes of questions costs\nyou nothing - the diagram takes as long as it takes - and it is the strongest signal you\nsend in the whole hour, because it is the part that most resembles the actual job. Someone\nwho starts drawing at minute two is telling you they will start building at minute two.\n\nThe second most common failure is spending forty minutes on the happy path and never\ngetting to failure modes. That is the section where senior candidates separate themselves,\nso protect the time for it: if you are still drawing boxes at minute forty, stop drawing\nand start breaking.\n\n## The questions to ask\n\nPick five or six. Asking all of them is its own failure - it reads as a checklist rather\nthan as thinking.\n\n**Scale and shape**\n- How many users or tenants, and how many events per day at peak?\n- Is the load spiky, and what drives the spikes? Anything time-driven - month end,\n  business hours, a seasonal deadline - changes the design more than the average rate does.\n- What is the payload size? A 2KB record and a 200MB file attachment are different systems.\n\n**Latency and consistency**\n- Is this synchronous, with someone waiting for the result, or can it be asynchronous?\n  This one question usually decides the whole architecture.\n- What is acceptable staleness for the derived data? Seconds or minutes?\n- Does someone need read-after-write consistency on their own edits?\n\n**Failure semantics**\n- If a dependency is down, do we block or proceed degraded?\n- Is duplicate processing acceptable, or must the observed effect be exactly once?\n- What is the cost of losing one record? That decides how much durability machinery is\n  justified.\n\n**Multi-tenancy**\n- Shared infrastructure with isolation, or separate deployments per tenant?\n- Can one tenant's bulk job degrade another tenant's interactive experience?\n\nThat last pair is worth asking in almost any round involving more than one customer. It\ndistinguishes a system that works in a demo from one that works with twenty customers on it.\n\n## Write the requirements down\n\nOn the board, before the diagram, in two short lists: functional (what it does) and\nnon-functional (how fast, how reliable, how big). Six lines is enough.\n\nThis is not ceremony. It gives you something to point at when you make a trade-off later -\n*\"I am choosing this because we agreed a minute of staleness is acceptable\"* - and it\nstops the interviewer from moving the goalposts mid-round, which some of them will do\ndeliberately to see whether you notice.\n\n## Narrate continuously\n\nSilence while drawing is dead air, and there will be a lot of drawing. Say what each box\nis for as you place it: *\"I am putting a queue here because I want the ingest endpoint to\nreturn before we call any third party.\"* The reason is the content; the box is just the\nnotation.",
      "problems": [],
      "checkpoint": {
        "id": "running-the-hour-checkpoint",
        "title": "Running the hour checkpoint",
        "questions": [
          {
            "id": "q-draw",
            "kind": "choice",
            "prompt": "The interviewer states the problem. It is minute two. What are you doing?",
            "options": [
              "Drawing the first two or three boxes to get something concrete on the board",
              "Asking scoping questions and writing the requirements down",
              "Stating your proposed architecture so they can redirect you early"
            ],
            "answer": 1,
            "explanation": "Drawing early is the most common failure in a design round. The first eight minutes of questions cost nothing and demonstrate the part of the job most like the real thing. Getting something concrete on the board matters at minute fifteen, not minute two."
          },
          {
            "id": "q-question",
            "kind": "choice",
            "prompt": "Which of these questions is most likely to change your architecture?",
            "options": [
              "What programming language should I assume?",
              "Is this synchronous, with a user waiting, or can it be asynchronous?",
              "How many engineers are on the team?"
            ],
            "answer": 1,
            "explanation": "Synchronous versus asynchronous decides whether there is a queue at all, what your latency budget is, and how you handle a slow dependency - it is usually the highest-leverage single question. Language rarely changes a design; team size is a delivery question and can be worth raising at the close, not the start."
          },
          {
            "id": "q-phases",
            "kind": "recall",
            "prompt": "From memory: the five phases and roughly how long each takes.",
            "modelAnswer": "Scope with questions, about eight minutes. Estimates and the core contract, about seven. The happy path diagram, about twenty-five. Failure modes, about twelve. Trade-offs and close, the last eight. The two you have to protect are the first and the fourth, because the middle expands to fill whatever you let it."
          },
          {
            "id": "q-multitenant",
            "kind": "explain",
            "prompt": "Out loud: ask the multi-tenancy question and say why the answer matters.",
            "modelAnswer": "'Is this shared infrastructure with tenant isolation, or a deployment per tenant? And can one tenant's bulk backfill degrade another tenant's interactive traffic?' It matters because it decides partition keys, whether you need priority lanes or separate queues, how you do capacity planning, and how a noisy-neighbour incident gets handled. It is also the question that most reliably shows you have run a multi-customer system rather than designed one."
          }
        ]
      },
      "completion": {
        "rule": "checkpoint-only",
        "requireCheckpoint": true,
        "checkpointPassScore": 0.75
      }
    },
    {
      "id": "estimates-that-justify-the-design",
      "title": "Estimates that justify the design",
      "summary": "Back-of-envelope numbers are not arithmetic for its own sake. One number - usually a gap between what you receive and what a dependency can absorb - justifies every decision you make afterwards.",
      "estimatedMinutes": 45,
      "objectives": [
        "Produce a peak rate from a daily volume with a defensible peak factor",